{
  "$schema": "./schemas/prompt-budgets.schema.json",
  "schemaVersion": 2,
  "approvedCorpus": {
    "sha256": "68bf2c552c54b6babbd423a632fdbf9f0a9763c1327730192b33595e4ddcfc0a",
    "words": 82695,
    "effectiveWords": 149376,
    "codexEstimatedTokens": 268946,
    "agents": {
      "aegis": 2430,
      "antigone": 3536,
      "ariadne": 3498,
      "aristarchus": 3105,
      "asklepios": 2910,
      "atalanta": 2796,
      "atlas": 4012,
      "charon": 3103,
      "daidalos": 2563,
      "hermes": 3308,
      "kalchas": 3213,
      "kleio": 3869,
      "lynceus": 2807,
      "metis": 3068,
      "minos": 3417,
      "mnemosyne": 2471,
      "nike": 2857,
      "odysseus": 798,
      "orion": 3873,
      "penelope": 2794,
      "perseus": 3572,
      "pistis": 2795,
      "proteus": 2943,
      "talos": 3084,
      "theseus": 2679,
      "tiresias": 3415,
      "tyche": 3779
    },
    "profiles": {
      "orchestration-core": 2371,
      "qa-browser": 364,
      "qa-core": 1847,
      "qa-coverage-reporting": 393,
      "qa-framework-runner": 798
    },
    "releaseVersion": "5.1.2",
    "approvedFor": "Argus 5.1.2 fixes template runner dependency drift; role prompts and model profiles are unchanged from 5.0.1",
    "benchmark": {
      "status": "pending",
      "reason": "No role prompt or model profile changed in 5.1.2; paired real-model discovery quality and cost evaluation has not been recorded."
    }
  },
  "nonRegression": {
    "minRepeats": 3,
    "recallTolerance": 0,
    "criticalRecallTolerance": 0,
    "precisionTolerance": 0.05
  },
  "budgets": {
    "maxClaudeAgentWords": 120000,
    "maxEffectiveClaudeWords": 180000,
    "maxAgentWords": 7500,
    "maxEffectiveAgentWords": 10000,
    "maxCodexEstimatedTokens": 330000,
    "minRunSkillWords": 300,
    "maxRunSkillWords": 700,
    "maxOdysseusAgentWords": 1200,
    "maxCodexCapabilityDeltaWords": 100,
    "maxFrontmatterToolEntries": 10,
    "maxToolNameBytesPerAgent": 160,
    "maxToolNameBytesCorpus": 2600,
    "maxPlaywrightMcpEntries": 2,
    "maxDescriptionWords": 30,
    "duplicateParagraphMinWords": 40,
    "maxDuplicatedDoctrineInstances": 0
  },
  "requiredPreloadedProfiles": [
    "qa-core"
  ],
  "optionalProfiles": [
    "competition-profile"
  ]
}
